{
  "schema": "glossa.captures/v1",
  "application": "web",
  "commit": "9f2c1e7a4b3d5c6e8f0a1b2c3d4e5f6a7b8c9d0e",
  "branch": "feat/checkout-copy",
  "tool": { "name": "glossa", "version": "0.9.0" },
  "captures": [
    {
      "route": "/checkout/[step]",
      "url": "http://localhost:4173/checkout/payment",
      "viewport": { "width": 390, "height": 844, "deviceScaleFactor": 2 },
      "locale": "de",
      "image": { "sha256": "3b1f0a4c5d6e7f8091a2b3c4d5e6f708192a3b4c5d6e7f8091a2b3c4d5e6f708", "width": 780, "height": 3120 },
      "renders": [
        { "index": 0, "key": "checkout.pay", "locale": "de" },
        { "index": 1, "key": "checkout.card.placeholder", "locale": "en" },
        { "index": 2, "key": "checkout.legal", "locale": "de" }
      ],
      "regions": [
        { "key": "cart.checkout", "kind": "element", "box": { "x": 16, "y": 720.5, "width": 358, "height": 48 }, "visible": true },
        { "index": 0, "kind": "text", "box": { "x": 24, "y": 1180, "width": 142.25, "height": 20 }, "visible": true },
        { "index": 1, "kind": "attribute", "attribute": "placeholder", "box": { "x": 16, "y": 960, "width": 358, "height": 44 }, "visible": true },
        { "index": 2, "kind": "text", "box": { "x": 0, "y": 0, "width": 0, "height": 0 }, "visible": false }
      ],
      "findings": [
        {
          "schema": "glossa.finding/v1",
          "layer": "visual",
          "code": "text-clipped",
          "severity": "warning",
          "locus": { "key": "cart.checkout", "region": "r_0" },
          "message": "Clipped: 412\u00d720 px of text in 358\u00d720 px.",
          "evidence": { "box": [358, 20], "content": [412, 20] }
        },
        {
          "schema": "glossa.finding/v1",
          "layer": "visual",
          "code": "untranslated-on-screen",
          "severity": "warning",
          "locus": { "key": "checkout.card.placeholder", "locale": "de", "region": "r_2" },
          "message": "Rendered from en on a de screen.",
          "evidence": { "resolved_from": "en" }
        },
        {
          "schema": "glossa.finding/v1",
          "layer": "visual",
          "code": "runtime-missing-message",
          "severity": "warning",
          "locus": { "key": "checkout.legal", "locale": "de" },
          "message": "The runtime reported missing-message: no message checkout.legal in de."
        }
      ]
    },
    {
      "route": "/",
      "url": "http://localhost:4173/",
      "viewport": { "width": 1280, "height": 800 },
      "locale": "en",
      "image": { "sha256": "9e8d7c6b5a4f3e2d1c0b9a8f7e6d5c4b3a2f1e0d9c8b7a6f5e4d3c2b1a0f9e8d", "width": 1280, "height": 2200 },
      "renders": [],
      "regions": [
        { "key": "home.hero.title", "kind": "element", "box": { "x": 320, "y": 180, "width": 640, "height": 72 }, "visible": true }
      ]
    }
  ]
}
